{
  "event": "keys:tags:batch_create",
  "message": "john.smith tagged 1 key in project Translation Project within branch new-feature-1",
  "sent_at": "2025-08-17 14:59:05 UTC",
  "user": {
    "id": "24b9a53ad72e198ca332fba91bb95f57",
    "username": "john.smith",
    "name": "John Smith",
    "gravatar_uid": "1bc5edb4799fd8eec67c66122f47eb73"
  },
  "project": {
    "id": "b2abd3bd2c23ff0ac546e0a2d9aa0be1",
    "name": "Translation Project",
    "slug": "translation-project",
    "main_format": "yml",
    "project_image_url": null,
    "created_at": "2025-02-07 16:18:13 UTC",
    "updated_at": "2025-02-07 16:18:13 UTC",
    "point_of_contact": null
  },
  "branch": {
    "name": "new-feature-1"
  },
  "keys": [
    {
      "id": "fe5b97045d80f91dd950b695d5ebe607",
      "tags": [
        {
          "name": "web"
        }
      ]
    }
  ]
}